<?xml version="1.0" encoding="UTF-8"?>
<!DOCTYPE games SYSTEM "games.dtd">
<games xmlns:xsi="http://www.w3.org/2001/XMLSchema-instance" xsi:noNamespaceSchemaLocation="games.xsd">
    <game>
        <id>1</id>
        <name>Valorant</name>
        <type>FPS</type>
        <releaseDate>2020-06-02</releaseDate>
        <rating>4.5</rating>
        <platform>PC</platform>
        <developer>Riot Games</developer>
        <price currency="USD">10</price>
    </game>
    <game>
        <id>2</id>
        <name>The Witcher 3</name>
        <type>RPG</type>
        <releaseDate>2015-05-19</releaseDate>
        <rating>4.8</rating>
        <platform>PC</platform>
        <developer>CD Projekt</developer>
        <price currency="USD">30</price>
    </game>
    <!-- Add more game entities here -->
</games>
